Code_Flow_matching/evaluation/v3_20261008_last_v1/analysis/rmsd_comparison.tsv

split	group	unit	count	share	input_rmsd_mean_a	refined_rmsd_mean_a	improvement_mean_a	input_rmsd_median_a	refined_rmsd_median_a	improvement_median_a	win_rate	worsen_rate	damage_ge_0.5_rate	post_rmsd_ge_2_rate
val	all	candidate	19722	1.0	8.184379185696685	7.774860880360004	0.4095183053366798	6.625050335	5.97855395	0.059516390000000086	0.6796470946151506	0.3196430382314167	0.06398945340229185	0.8723760267721327
val	input RMSD <2 Å	candidate	2630	0.13335361525200284	1.2448244650532319	1.1185271623193915	0.12629730273384032	1.391687765	0.9129613050000001	0.15970004999999998	0.711787072243346	0.28821292775665397	0.1505703422053232	0.12091254752851711
val	length <=50 nt	candidate	9400	0.47662508873339415	6.666853010379787	5.950601729842553	0.7162512805372341	5.9676455399999995	5.403863135	0.22685239499999943	0.6923404255319149	0.3076595744680851	0.11212765957446809	0.8602127659574468
val	length 51-100 nt	candidate	4000	0.20281918669506135	8.13195266312	7.9155917246525	0.2163609384675	4.90859478	4.81845706	0.1779869999999999	0.79175	0.20825	0.052	0.70025
val	length 101-200 nt	candidate	2702	0.13700436061251395	14.940694062720207	14.763622317453738	0.1770717452664693	16.57349541	16.536285900000003	0.03162137000000076	0.7420429311621022	0.2579570688378979	0.0	0.9985196150999259
val	length >200 nt	candidate	3620	0.18355136395903052	7.13987347867127	7.139910392698895	-3.691402762430964e-05	5.687180215	5.686927915	-4.608999999988761e-05	0.47624309392265196	0.519889502762431	0.0	1.0
val	input RMSD [0,2) Å	candidate	2630	0.13335361525200284	1.2448244650532319	1.1185271623193915	0.12629730273384032	1.391687765	0.9129613050000001	0.15970004999999998	0.711787072243346	0.28821292775665397	0.1505703422053232	0.12091254752851711
val	input RMSD [2,5) Å	candidate	4914	0.24916337085488288	3.6712698245543347	3.7110097907427755	-0.039739966188441195	3.728571625	3.677724145	-0.001071354999999885	0.41676841676841675	0.5807895807895808	0.16056166056166057	0.998982498982499
val	input RMSD [5,10) Å	candidate	6591	0.33419531487678733	7.369446118963738	7.061535028440298	0.30791109052344107	7.64461381	7.26702972	0.13782585999999952	0.7325140342891823	0.26718252162039147	0.010013654984069186	1.0
val	input RMSD [10,20) Å	candidate	4264	0.2162052530169354	14.451765908914165	13.100398659383208	1.3513672495309568	13.285982574999998	12.85558563	0.11092560999999979	0.8348968105065666	0.1651031894934334	0.0025797373358348967	0.9530956848030019
val	input RMSD [20,30) Å	candidate	1323	0.06708244599939155	22.602773116900984	22.490930066356764	0.11184305054421775	21.72061704	21.628842	0.060149580000000924	0.8284202569916855	0.17157974300831444	0.0	1.0
val	input RMSD [30,inf) Å	candidate	0	0.0	nan	nan	nan	nan	nan	nan	nan	nan	nan	nan
val	all	PDB-chain macro	103	1.0	8.97387174957609	8.58150276168599	0.39236898789009916	7.58574502305	6.6614381319	0.07527561424999973	0.7378640776699029	0.2621359223300971	0.04854368932038835	0.883495145631068
val	input RMSD <2 Å	PDB-chain macro	13	0.1262135922330097	1.2699485468153848	1.0927321134653847	0.17721643334999998	1.58179039995	0.8803638847	0.27439467760000014	0.7692307692307693	0.23076923076923078	0.07692307692307693	0.15384615384615385
val	length <=50 nt	PDB-chain macro	47	0.4563106796116505	6.6668530103797865	5.950601729842553	0.7162512805372341	5.8488250826499995	5.36740863385	0.2522264959999987	0.7446808510638298	0.2553191489361702	0.0851063829787234	0.8723404255319149
val	length 51-100 nt	PDB-chain macro	20	0.1941747572815534	8.13195266312	7.915591724652501	0.21636093846749982	5.212441245275	5.176508206225	0.19820147062500038	0.85	0.15	0.05	0.7
val	length 101-200 nt	PDB-chain macro	14	0.13592233009708737	15.12237071712527	14.949973484407636	0.17239723271763446	18.129604286625	18.082638744100002	0.0335007103749998	0.9285714285714286	0.07142857142857142	0.0	1.0
val	length >200 nt	PDB-chain macro	22	0.21359223300970873	10.755202518924243	10.754774539831818	0.0004279790924242829	6.2239177034	6.223796304125	-3.466687500019994e-05	0.5	0.5	0.0	1.0
val	input RMSD [0,2) Å	PDB-chain macro	13	0.1262135922330097	1.2699485468153848	1.0927321134653847	0.17721643334999998	1.58179039995	0.8803638847	0.27439467760000014	0.7692307692307693	0.23076923076923078	0.07692307692307693	0.15384615384615385
val	input RMSD [2,5) Å	PDB-chain macro	21	0.20388349514563106	3.5464008541309524	3.573489859154762	-0.02708900502380955	3.53638545065	3.6463507663000003	-0.0015195703500001656	0.3333333333333333	0.6666666666666666	0.14285714285714285	1.0
val	input RMSD [5,10) Å	PDB-chain macro	36	0.34951456310679613	7.216821600609723	6.960254446827778	0.25656715378194467	7.6785314359	7.374887381924999	0.11002625617500028	0.7777777777777778	0.2222222222222222	0.027777777777777776	1.0
val	input RMSD [10,20) Å	PDB-chain macro	25	0.24271844660194175	15.23276661936871	14.068708677139421	1.1640579422292898	15.0747344616	14.747191089400001	0.10898846444999855	0.96	0.04	0.0	0.96
val	input RMSD [20,30) Å	PDB-chain macro	8	0.07766990291262135	24.08753725685242	24.04488786525893	0.04264939159349446	23.189380015875003	23.061909887875004	0.017042393491667696	0.875	0.125	0.0	1.0
val	input RMSD [30,inf) Å	PDB-chain macro	0	0.0	nan	nan	nan	nan	nan	nan	nan	nan	nan	nan
test	all	candidate	12310	1.0	9.053198354800163	8.989119512052802	0.06407884274735987	4.917126424999999	4.968090589999999	0.008201915000000781	0.6050365556458164	0.3948822095857027	0.08359057676685622	0.9679122664500406
test	input RMSD <2 Å	candidate	780	0.06336311941510966	1.5530534299615386	1.9666130650641027	-0.4135596351025641	1.6343359350000002	1.955568325	-0.48652294499999993	0.005128205128205128	0.9948717948717949	0.4756410256410256	0.4935897435897436
test	length <=50 nt	candidate	4600	0.3736799350121852	5.0887454385304345	4.946021491186957	0.14272394734347826	4.31932054	4.154835735	0.19567333999999992	0.6347826086956522	0.3652173913043478	0.18	0.956304347826087
test	length 51-100 nt	candidate	3600	0.2924451665312754	4.7009354649888895	4.717926243705556	-0.01699077871666667	4.146409135	4.10831602	0.002808980000000183	0.5197222222222222	0.4802777777777778	0.05472222222222222	0.9994444444444445
test	length 101-200 nt	candidate	1387	0.11267262388302193	19.847971852415284	19.722852003157897	0.1251198492573901	21.81027193	21.65614926	0.08267237999999821	0.7815428983417447	0.21845710165825521	0.002883922134102379	1.0
test	length >200 nt	candidate	2723	0.22120227457351746	16.00592658725303	15.998616279173705	0.007310308079324228	11.20723032	11.2023765	0.0002062299999998629	0.5776716856408373	0.42196107234667646	0.0	0.9294895336026442
test	input RMSD [0,2) Å	candidate	780	0.06336311941510966	1.5530534299615386	1.9666130650641027	-0.4135596351025641	1.6343359350000002	1.955568325	-0.48652294499999993	0.005128205128205128	0.9948717948717949	0.4756410256410256	0.4935897435897436
test	input RMSD [2,5) Å	candidate	5441	0.4419983753046304	3.6907924896710167	3.6963323793990073	-0.005539889727991177	3.9013939	3.74417039	-4.825000000030499e-05	0.4973350487042823	0.5024811615511855	0.11946333394596581	1.0
test	input RMSD [5,10) Å	candidate	3069	0.24930950446791228	6.987652903492994	6.709373103828609	0.2782797996643858	6.62131769	6.49919662	0.16799482000000054	0.819485174323884	0.180514825676116	0.0013033561420658195	1.0
test	input RMSD [10,20) Å	candidate	1154	0.09374492282696995	15.46096311671577	15.328825349956672	0.13213776675909877	16.65628482	16.598503385	0.03752226000000114	0.6993067590987868	0.3006932409012132	0.0	1.0
test	input RMSD [20,30) Å	candidate	1666	0.13533712428919578	25.03882568087635	24.957918078655464	0.08090760222088834	25.211397124999998	25.13507043	0.010993125000000603	0.776110444177671	0.22388955582232895	0.0024009603841536613	1.0
test	input RMSD [30,inf) Å	candidate	200	0.016246953696181964	45.75073177035	45.749682488850006	0.0010492814999996192	45.071054520000004	45.070833305	0.001732979999999884	0.615	0.385	0.0	1.0
test	all	PDB-chain macro	67	1.0	10.491819891601837	10.431955468126622	0.059864423475215194	5.8540920083	5.54680010925	0.0071754169512168176	0.6567164179104478	0.34328358208955223	0.07462686567164178	0.9701492537313433
test	input RMSD <2 Å	PDB-chain macro	4	0.05970149253731343	1.5878016185875001	1.9790405296499998	-0.39123891106249986	1.6215348595	1.977107131675	-0.42690554994999974	0.0	1.0	0.5	0.5
test	length <=50 nt	PDB-chain macro	23	0.34328358208955223	5.088745438530435	4.946021491186957	0.14272394734347812	4.2625990257	4.6389892780499995	0.20272722124999998	0.6521739130434783	0.34782608695652173	0.17391304347826086	0.9565217391304348
test	length 51-100 nt	PDB-chain macro	18	0.26865671641791045	4.7009354649888895	4.717926243705556	-0.016990778716666568	4.1906416902500006	4.147462710575001	-0.005096892475000114	0.5	0.5	0.05555555555555555	1.0
test	length 101-200 nt	PDB-chain macro	7	0.1044776119402985	19.90817931104129	19.784136918483846	0.12404239255744834	22.05008508	21.5522353993	0.08895280425000252	1.0	0.0	0.0	1.0
test	length >200 nt	PDB-chain macro	19	0.2835820895522388	19.049299689686002	19.040573223741934	0.008726465944067447	23.477055367272726	23.459343300681816	0.0010030410000041456	0.6842105263157895	0.3157894736842105	0.0	0.9473684210526315
test	input RMSD [0,2) Å	PDB-chain macro	4	0.05970149253731343	1.5878016185875001	1.9790405296499998	-0.39123891106249986	1.6215348595	1.977107131675	-0.42690554994999974	0.0	1.0	0.5	0.5
test	input RMSD [2,5) Å	PDB-chain macro	25	0.373134328358209	3.6883378357620002	3.678353697654	0.009984138108000078	3.98291594535	3.6785599805499998	0.00018422489999991853	0.52	0.48	0.12	1.0
test	input RMSD [5,10) Å	PDB-chain macro	19	0.2835820895522388	7.113806859157895	6.886410009805264	0.2273968493526315	6.584944790250001	6.5497433994000005	0.09325675729999894	0.7894736842105263	0.21052631578947367	0.0	1.0
test	input RMSD [10,20) Å	PDB-chain macro	3	0.04477611940298507	16.161931161499997	16.127814529583333	0.034116631916665696	16.9954493805	16.961230565250002	0.03421881524999648	0.6666666666666666	0.3333333333333333	0.0	1.0
test	input RMSD [20,30) Å	PDB-chain macro	15	0.22388059701492538	24.999561652671538	24.939406369375572	0.060155283295961696	24.743133315434783	24.731315361594202	0.009086050802139312	0.8666666666666667	0.13333333333333333	0.0	1.0
test	input RMSD [30,inf) Å	PDB-chain macro	1	0.014925373134328358	45.75073177035	45.749682488850006	0.0010492814999949474	45.75073177035	45.749682488850006	0.0010492814999949474	1.0	0.0	0.0	1.0

Code_Flow_matching/evaluation/v3_20261008_last_v1/val_final/report.md

# val refinement evaluation

- checkpoint: `/storage9920/home/tinghao.xia/Code_Flow_matching/checkpoints/rna_refinement_v3_residual_mobility/last-v1.ckpt`
- candidates: 19722
- PDB chains: 103
- candidate-level mean RMSD: 8.1844 → 7.7749 Å
- candidate win/worsen rate: 67.96% / 31.96%
- PDB-chain macro mean improvement: 0.3924 Å (95% bootstrap CI 0.1543, 0.7114)
- PDB-chain win/worsen rate: 73.79% / 26.21%
- Spearman(length, improvement): -0.3331
- Spearman(input RMSD, improvement): 0.1708
- Spearman(mean pLDDT, improvement): 0.1466