Code_Flow_matching/evaluation/v3_rank1_epoch49_20261008/analysis/rmsd_comparison.tsv

split	group	unit	count	share	input_rmsd_mean_a	refined_rmsd_mean_a	improvement_mean_a	input_rmsd_median_a	refined_rmsd_median_a	improvement_median_a	win_rate	worsen_rate	damage_ge_0.5_rate	post_rmsd_ge_2_rate
val	all	candidate	103	1.0	9.350352672524272	8.920694509805825	0.42965816271844665	7.89408999	6.81238066	0.05366522999999995	0.6699029126213593	0.3300970873786408	0.02912621359223301	0.883495145631068
val	input RMSD <2 Å	candidate	12	0.11650485436893204	1.1996002774999999	0.9631872516666666	0.23641302583333332	1.46351173	0.9163058049999999	0.22713420499999998	0.75	0.25	0.08333333333333333	0.08333333333333333
val	length <=50 nt	candidate	47	0.4563106796116505	6.953469270851064	6.1581622934042555	0.7953069774468087	6.76973692	5.43361293	0.22479161999999953	0.723404255319149	0.2765957446808511	0.0425531914893617	0.8723404255319149
val	length 51-100 nt	candidate	20	0.1941747572815534	8.7798035735	8.570035172	0.20976840149999995	4.87479148	4.6364513249999995	0.2268458400000002	0.7	0.3	0.05	0.7
val	length 101-200 nt	candidate	14	0.13592233009708737	16.036383819285714	15.845660660714286	0.19072315857142857	16.43970875	16.4222355	0.03699359500000021	0.7142857142857143	0.2857142857142857	0.0	1.0
val	length >200 nt	candidate	22	0.21359223300970873	10.734901118181817	10.734452455909091	0.0004486622727274706	6.02329909	6.023365764999999	-5.403500000000783e-05	0.5	0.5	0.0	1.0
val	input RMSD [0,2) Å	candidate	12	0.11650485436893204	1.1996002774999999	0.9631872516666666	0.23641302583333332	1.46351173	0.9163058049999999	0.22713420499999998	0.75	0.25	0.08333333333333333	0.08333333333333333
val	input RMSD [2,5) Å	candidate	24	0.23300970873786409	3.5420147833333337	3.50360901375	0.03840576958333336	3.40765895	3.44483738	-0.0008557750000000031	0.4583333333333333	0.5416666666666666	0.08333333333333333	1.0
val	input RMSD [5,10) Å	candidate	30	0.2912621359223301	7.305462303333333	6.9535222779999994	0.3519400253333334	7.713580155000001	7.183390825	0.22194848999999905	0.7333333333333333	0.26666666666666666	0.0	1.0
val	input RMSD [10,20) Å	candidate	25	0.24271844660194175	14.3716973116	13.208682352799999	1.1630149588	14.69988373	13.37688631	0.033254389999999745	0.68	0.32	0.0	0.96
val	input RMSD [20,30) Å	candidate	12	0.11650485436893204	23.768872104166665	23.696995333333334	0.07187677083333366	22.91642291	22.85764253	0.01443225000000048	0.8333333333333334	0.16666666666666666	0.0	1.0
val	input RMSD [30,inf) Å	candidate	0	0.0	nan	nan	nan	nan	nan	nan	nan	nan	nan	nan
val	all	PDB-chain macro	103	1.0	9.350352672524272	8.920694509805825	0.42965816271844665	7.89408999	6.81238066	0.05366522999999995	0.6699029126213593	0.3300970873786408	0.02912621359223301	0.883495145631068
val	input RMSD <2 Å	PDB-chain macro	12	0.11650485436893204	1.1996002774999999	0.9631872516666666	0.23641302583333332	1.46351173	0.9163058049999999	0.22713420499999998	0.75	0.25	0.08333333333333333	0.08333333333333333
val	length <=50 nt	PDB-chain macro	47	0.4563106796116505	6.953469270851064	6.1581622934042555	0.7953069774468087	6.76973692	5.43361293	0.22479161999999953	0.723404255319149	0.2765957446808511	0.0425531914893617	0.8723404255319149
val	length 51-100 nt	PDB-chain macro	20	0.1941747572815534	8.7798035735	8.570035172	0.20976840149999995	4.87479148	4.6364513249999995	0.2268458400000002	0.7	0.3	0.05	0.7
val	length 101-200 nt	PDB-chain macro	14	0.13592233009708737	16.036383819285714	15.845660660714286	0.19072315857142857	16.43970875	16.4222355	0.03699359500000021	0.7142857142857143	0.2857142857142857	0.0	1.0
val	length >200 nt	PDB-chain macro	22	0.21359223300970873	10.734901118181817	10.734452455909091	0.0004486622727274706	6.02329909	6.023365764999999	-5.403500000000783e-05	0.5	0.5	0.0	1.0
val	input RMSD [0,2) Å	PDB-chain macro	12	0.11650485436893204	1.1996002774999999	0.9631872516666666	0.23641302583333332	1.46351173	0.9163058049999999	0.22713420499999998	0.75	0.25	0.08333333333333333	0.08333333333333333
val	input RMSD [2,5) Å	PDB-chain macro	24	0.23300970873786409	3.5420147833333337	3.50360901375	0.03840576958333336	3.40765895	3.44483738	-0.0008557750000000031	0.4583333333333333	0.5416666666666666	0.08333333333333333	1.0
val	input RMSD [5,10) Å	PDB-chain macro	30	0.2912621359223301	7.305462303333333	6.9535222779999994	0.3519400253333334	7.713580155000001	7.183390825	0.22194848999999905	0.7333333333333333	0.26666666666666666	0.0	1.0
val	input RMSD [10,20) Å	PDB-chain macro	25	0.24271844660194175	14.3716973116	13.208682352799999	1.1630149588	14.69988373	13.37688631	0.033254389999999745	0.68	0.32	0.0	0.96
val	input RMSD [20,30) Å	PDB-chain macro	12	0.11650485436893204	23.768872104166665	23.696995333333334	0.07187677083333366	22.91642291	22.85764253	0.01443225000000048	0.8333333333333334	0.16666666666666666	0.0	1.0
val	input RMSD [30,inf) Å	PDB-chain macro	0	0.0	nan	nan	nan	nan	nan	nan	nan	nan	nan	nan
test	all	candidate	67	1.0	10.426974567910447	10.351002885074628	0.07597168283582086	5.13266399	5.0042819	0.0032634099999988564	0.5970149253731343	0.3880597014925373	0.014925373134328358	0.9552238805970149
test	input RMSD <2 Å	candidate	3	0.04477611940298507	1.6454982633333335	1.7797634233333335	-0.1342651599999999	1.77207653	1.77207596	-0.18770640999999988	0.0	0.6666666666666666	0.0	0.0
test	length <=50 nt	candidate	23	0.34328358208955223	5.153178789130435	4.962209578695652	0.1909692104347827	4.46222986	4.21910106	0.16548052999999996	0.7391304347826086	0.2608695652173913	0.043478260869565216	0.9565217391304348
test	length 51-100 nt	candidate	18	0.26865671641791045	4.305751546111111	4.3024933644444445	0.003258181666666619	4.133697165	4.09220786	-0.008855529999999945	0.4444444444444444	0.5555555555555556	0.0	0.9444444444444444
test	length 101-200 nt	candidate	7	0.1044776119402985	19.597993374285714	19.538477215714288	0.05951615857142846	23.25201842	22.93658595	0.007357620000000509	0.5714285714285714	0.42857142857142855	0.0	1.0
test	length >200 nt	candidate	19	0.2835820895522388	19.231300128947368	19.219586943157896	0.01171318578947354	23.51630497	23.50608919	0.0006020000000006576	0.5789473684210527	0.3684210526315789	0.0	0.9473684210526315
test	input RMSD [0,2) Å	candidate	3	0.04477611940298507	1.6454982633333335	1.7797634233333335	-0.1342651599999999	1.77207653	1.77207596	-0.18770640999999988	0.0	0.6666666666666666	0.0	0.0
test	input RMSD [2,5) Å	candidate	29	0.43283582089552236	3.622055285517241	3.617825517586207	0.004229767931034464	3.85570587	3.77971959	-7.842000000035654e-05	0.4827586206896552	0.5172413793103449	0.034482758620689655	1.0
test	input RMSD [5,10) Å	candidate	15	0.22388059701492538	6.939512530666667	6.629384787999999	0.3101277426666667	6.74715073	6.64085252	0.16548052999999996	0.8	0.2	0.0	1.0
test	input RMSD [10,20) Å	candidate	5	0.07462686567164178	15.524493388	15.479827556	0.04466583199999974	16.26449022	16.29693507	0.012366919999999837	0.6	0.4	0.0	1.0
test	input RMSD [20,30) Å	candidate	14	0.208955223880597	26.089515075714285	26.054430590714286	0.035084484999999485	26.25459733	26.244718374999998	0.0027798549999999977	0.7142857142857143	0.2857142857142857	0.0	1.0
test	input RMSD [30,inf) Å	candidate	1	0.014925373134328358	41.66283202	41.65902515	0.003806870000005347	41.66283202	41.65902515	0.003806870000005347	1.0	0.0	0.0	1.0
test	all	PDB-chain macro	67	1.0	10.426974567910447	10.351002885074628	0.07597168283582086	5.13266399	5.0042819	0.0032634099999988564	0.5970149253731343	0.3880597014925373	0.014925373134328358	0.9552238805970149
test	input RMSD <2 Å	PDB-chain macro	3	0.04477611940298507	1.6454982633333335	1.7797634233333335	-0.1342651599999999	1.77207653	1.77207596	-0.18770640999999988	0.0	0.6666666666666666	0.0	0.0
test	length <=50 nt	PDB-chain macro	23	0.34328358208955223	5.153178789130435	4.962209578695652	0.1909692104347827	4.46222986	4.21910106	0.16548052999999996	0.7391304347826086	0.2608695652173913	0.043478260869565216	0.9565217391304348
test	length 51-100 nt	PDB-chain macro	18	0.26865671641791045	4.305751546111111	4.3024933644444445	0.003258181666666619	4.133697165	4.09220786	-0.008855529999999945	0.4444444444444444	0.5555555555555556	0.0	0.9444444444444444
test	length 101-200 nt	PDB-chain macro	7	0.1044776119402985	19.597993374285714	19.538477215714288	0.05951615857142846	23.25201842	22.93658595	0.007357620000000509	0.5714285714285714	0.42857142857142855	0.0	1.0
test	length >200 nt	PDB-chain macro	19	0.2835820895522388	19.231300128947368	19.219586943157896	0.01171318578947354	23.51630497	23.50608919	0.0006020000000006576	0.5789473684210527	0.3684210526315789	0.0	0.9473684210526315
test	input RMSD [0,2) Å	PDB-chain macro	3	0.04477611940298507	1.6454982633333335	1.7797634233333335	-0.1342651599999999	1.77207653	1.77207596	-0.18770640999999988	0.0	0.6666666666666666	0.0	0.0
test	input RMSD [2,5) Å	PDB-chain macro	29	0.43283582089552236	3.622055285517241	3.617825517586207	0.004229767931034464	3.85570587	3.77971959	-7.842000000035654e-05	0.4827586206896552	0.5172413793103449	0.034482758620689655	1.0
test	input RMSD [5,10) Å	PDB-chain macro	15	0.22388059701492538	6.939512530666667	6.629384787999999	0.3101277426666667	6.74715073	6.64085252	0.16548052999999996	0.8	0.2	0.0	1.0
test	input RMSD [10,20) Å	PDB-chain macro	5	0.07462686567164178	15.524493388	15.479827556	0.04466583199999974	16.26449022	16.29693507	0.012366919999999837	0.6	0.4	0.0	1.0
test	input RMSD [20,30) Å	PDB-chain macro	14	0.208955223880597	26.089515075714285	26.054430590714286	0.035084484999999485	26.25459733	26.244718374999998	0.0027798549999999977	0.7142857142857143	0.2857142857142857	0.0	1.0
test	input RMSD [30,inf) Å	PDB-chain macro	1	0.014925373134328358	41.66283202	41.65902515	0.003806870000005347	41.66283202	41.65902515	0.003806870000005347	1.0	0.0	0.0	1.0

Code_Flow_matching/evaluation/v3_rank1_epoch49_20261008/test_locked/report.md

# test refinement evaluation

- checkpoint: `/storage9920/home/tinghao.xia/Code_Flow_matching/checkpoints/rna_refinement_v3_residual_mobility/epoch=49-step=157550.ckpt`
- candidates: 67
- PDB chains: 67
- candidate-level mean RMSD: 10.4270 → 10.3510 Å
- candidate win/worsen rate: 59.70% / 38.81%
- PDB-chain macro mean improvement: 0.0760 Å (95% bootstrap CI -0.0108, 0.1639)
- PDB-chain win/worsen rate: 59.70% / 38.81%
- Spearman(length, improvement): -0.2634
- Spearman(input RMSD, improvement): 0.2815
- Spearman(mean pLDDT, improvement): -0.0364